href,tool,desc,toolb
/en/pro-app/2.7/tool-reference/territory-design/an-overview-of-the-territory-solution-toolset.htm,Territory Solution,"The  Territory Solution toolset contains tools to set up, modify, and manage territories.
  This toolset allows you to build territory hierarchy, manage external variables, and set up constraints.",Territory Design toolbox
/en/pro-app/2.7/tool-reference/topographic-production/an-overview-of-the-cartography-toolset.htm,Cartography,The Cartography toolset contains toolsets used for creating cartographic data.,Topographic Production toolbox
/en/pro-app/2.7/tool-reference/topographic-production/an-overview-of-the-data-management-toolset.htm,Data Management,"The Data Management toolset
contains toolsets for  importing, exporting, and managing edits to your data.",Topographic Production toolbox
/en/pro-app/2.7/tool-reference/topographic-production/an-overview-of-the-workflow-toolset.htm,Workflow,The Workflow toolset contains toolsets and tools that are used as part of the Topographic Mapping production workflows.,Topographic Production toolbox
/en/pro-app/2.7/tool-reference/trace-network/add-network-attribute.htm,Add Network Attribute,Adds a network attribute to a trace network.,Trace Network toolbox
/en/pro-app/2.7/tool-reference/trace-network/convert-geometric-network-to-trace-network.htm,Convert Geometric Network To Trace Network,Converts a geometric network to a trace network.,Trace Network toolbox
/en/pro-app/2.7/tool-reference/trace-network/create-trace-network.htm,Create Trace Network,Creates a trace network.,Trace Network toolbox
/en/pro-app/2.7/tool-reference/trace-network/disable-network-topology.htm,Disable Network Topology,Disables the network topology for an existing trace network.,Trace Network toolbox
/en/pro-app/2.7/tool-reference/trace-network/enable-network-topology.htm,Enable Network Topology,A network topology is necessary for analytic operations such as tracing and to use network diagrams. A network topology can also be enabled to discover error features.,Trace Network toolbox
/en/pro-app/2.7/tool-reference/trace-network/set-flow-direction.htm,Set Flow Direction,Sets the flow direction of line features in a version 1 trace network.,Trace Network toolbox
/en/pro-app/2.7/tool-reference/trace-network/set-network-attribute.htm,Set Network Attribute,Assigns a network attribute to a feature class to be used during trace operations.,Trace Network toolbox
/en/pro-app/2.7/tool-reference/trace-network/trace.htm,Trace,Returns selected features in a trace network based on connectivity or traversability from the specified starting points.,Trace Network toolbox
/en/pro-app/2.7/tool-reference/trace-network/validate-network-topology.htm,Validate Network Topology,Validates the network topology of a trace network.  Validation of  the network topology is necessary after edits have been made to network attributes or the geometry of features in the network.,Trace Network toolbox
